{
  "schemaVersion": "1.0.0",
  "labId": "13",
  "runId": "fixture-demo",
  "ownerToken": "00000000000000000000000000000000",
  "context": {
    "labId": "13",
    "runId": "fixture-demo",
    "githubOwner": "",
    "adoOrganization": "",
    "subscriptionId": "",
    "location": "westeurope"
  },
  "status": "initialized",
  "objects": [],
  "checkpoints": [],
  "liveVerified": false
}
